word,meaning,mnemonic,image,video,example,synonyms,antonyms,difficulty,category,setIds
Mopupunu,Perfect couple,Puchu,https://images.unsplash.com/photo-1506744038136-46273834b3fb?auto=format&fit=crop&w=400&q=80, https://storage.googleapis.com/word_vocabulary/words/lucid/movie.mov,The guide obfuscated the real path to keep us safe.,"confuse, blur, befuddle","clarify, explain",hard,academic,sat
lucid,expressed clearly; easy to understand,लुसीड = लाइट = क्लियर,https://images.unsplash.com/photo-1465101046530-73398c7f28ca?auto=format&fit=crop&w=400&q=80, https://storage.googleapis.com/word_vocabulary/words/lucid/movie.mov,She gave a lucid presentation on the topic.,"clear, intelligible","confusing, obscure",medium,common,sat
gregarious,fond of company; sociable,गाँव में ग्रेगरी सबका दोस्त है,https://images.unsplash.com/photo-1519125323398-675f0ddb6308?auto=format&fit=crop&w=400&q=80, https://storage.googleapis.com/word_vocabulary/words/lucid/movie.mov,He was a popular and gregarious man.,"sociable, outgoing","reserved, unsociable",easy,common,sat
ubiquitous,"Present, appearing, or found everywhere",यू बिक गया हर जगह,, https://storage.googleapis.com/word_vocabulary/words/lucid/movie.mov,Mobile phones are ubiquitous these days.,"omnipresent, pervasive","rare, scarce",medium,academic,sat
ephemeral,Lasting for a very short time,"इफ ए मेल आया, तुरंत चला गया",, https://storage.googleapis.com/word_vocabulary/words/lucid/movie.mov,Fame in the film industry is often ephemeral.,"fleeting, transient","permanent, lasting",hard,academic,sat
altruistic,Showing a selfless concern for the well-being of others,All true stick together for others,, https://storage.googleapis.com/word_vocabulary/words/lucid/movie.mov,Her altruistic nature made her popular among her friends.,"selfless, charitable","selfish, self-centered",medium,common,gre
belligerent,Hostile and aggressive,बेल (bell) बजाते ही लड़ाई शुरू,, https://storage.googleapis.com/word_vocabulary/words/lucid/movie.mov,His belligerent attitude caused many problems.,"aggressive, hostile","peaceful, friendly",medium,academic,gre
cacophony,"A harsh, discordant mixture of sounds",काका फनी आवाज़ में गाते हैं,, https://storage.googleapis.com/word_vocabulary/words/lucid/movie.mov,The cacophony in the market made it hard to concentrate.,"din, racket","harmony, silence",hard,academic,gre
pristine,In its original condition; unspoiled,Priya's teen room is always clean,, https://storage.googleapis.com/word_vocabulary/words/lucid/movie.mov,The mountains are still in pristine condition.,"pure, spotless","dirty, spoiled",medium,common,gre
sagacious,Having or showing keen mental discernment and good judgment,सगा (relative) always gives wise advice,, https://storage.googleapis.com/word_vocabulary/words/lucid/movie.mov,The sagacious leader guided the team to success.,"wise, prudent","foolish, ignorant",hard,academic,gre
lethargic,Affected by lethargy; sluggish and apathetic,"लेट (late) हो गया, energy नहीं है",, https://storage.googleapis.com/word_vocabulary/words/lucid/movie.mov,"After lunch, I always feel lethargic.","sluggish, inactive","energetic, active",easy,common,gre
magnanimous,Very generous or forgiving,मगन (happy) आदमी हमेशा माफ करता है,, https://storage.googleapis.com/word_vocabulary/words/lucid/movie.mov,He was magnanimous in victory.,"generous, charitable","petty, mean",medium,academic,mylist
quixotic,Exceedingly idealistic; unrealistic and impractical,Quick exotic ideas are impractical,, https://storage.googleapis.com/word_vocabulary/words/lucid/movie.mov,His quixotic plans were never realized.,"idealistic, impractical","realistic, pragmatic",hard,academic,mylistfawn,try to gain favor by extreme flattery,,,https://storage.googleapis.com/word_vocabulary/words/lucid/movie.mov,"The media fawned over the handsome new CEO, praising his impeccable sense of style instead of asking more pointed questions.",,,medium,academic,gre
banal,repeated too often; overfamiliar through overuse,,,https://storage.googleapis.com/word_vocabulary/words/lucid/movie.mov,The professor used such banal expression that many students in the class either fell asleep from boredom or stayed awake to complete his sentences and humor friends.,,,medium,academic,gre
dissolution,a living full of debauchery and indulgence in sensual pleasure,,,https://storage.googleapis.com/word_vocabulary/words/lucid/movie.mov,"Many Roman emperors were known for their dissolution, indulging in unspeakable desires of the flesh.",,,medium,academic,gre
pejorative,expressing disapproval (usu. refers to a term),,,https://storage.googleapis.com/word_vocabulary/words/lucid/movie.mov,"Most psychologists object to the pejorative term ""shrink"", believing that they expand the human mind, not limit it.",,,medium,academic,gre
peruse,to read very carefully,,,https://storage.googleapis.com/word_vocabulary/words/lucid/movie.mov,"Instead of perusing important documents, people all too often rush to the bottom of the page and plaster their signatures at the bottom.",,,medium,academic,gre
importune,beg persistently and urgently,,,https://storage.googleapis.com/word_vocabulary/words/lucid/movie.mov,"After weeks of importuning the star to meet for a five-minute interview, the journalist finally got what she wanted.",,,medium,academic,gre
umbrage,a feeling of anger caused by being offended,,,https://storage.googleapis.com/word_vocabulary/words/lucid/movie.mov,"Since he was so in love with her, he took umbrage at her comments, even though she had only meant to gently tease him.",,,medium,academic,gre
fecund,intellectually productive,,,https://storage.googleapis.com/word_vocabulary/words/lucid/movie.mov,"The artist had entered a fecund period, producing three masterpieces in the span of two months.",,,medium,academic,gre
renege,fail to fulfill a promise or obligation,,,https://storage.googleapis.com/word_vocabulary/words/lucid/movie.mov,We will no longer work with that vendor since it has reneged on nearly every agreement.,,,medium,academic,gre
ornate,marked by elaborate rhetoric and elaborated with decorative details,,,https://storage.googleapis.com/word_vocabulary/words/lucid/movie.mov,The ornate Victorian and Edwardian homes spread throughout San Francisco are my favorite part of the city.,,,medium,academic,gre
impute,attribute (responsibility or fault) to something,,,https://storage.googleapis.com/word_vocabulary/words/lucid/movie.mov,He imputed his subpar performance on the test to a combination of stress and poor sleep.,,,medium,academic,gre
urbane,showing a high degree of refinement and the assurance that comes from wide social experience,,,https://storage.googleapis.com/word_vocabulary/words/lucid/movie.mov,"Because of his service as an intelligence officer and his refined tastes, W. Somerset Maugham became the inspiration for the urbane and sophisticate spy James Bond.",,,medium,academic,gre
plodding,(of movement) slow and laborious,,,https://storage.googleapis.com/word_vocabulary/words/lucid/movie.mov,"Charlie may seem to run at a plodding pace, but he is an ultramarathoner, meaning he runs distances of up to 100 miles, and can run for ten hours at a stretch.",,,medium,academic,gre
row,an angry dispute,,,https://storage.googleapis.com/word_vocabulary/words/lucid/movie.mov,The Prime Minister looked very foolish after his row with the foreign dignitary was caught on video and posted on youtube.,,,medium,academic,gre
cow,to intimidate,,,https://storage.googleapis.com/word_vocabulary/words/lucid/movie.mov,"Do not be cowed by a 3,000-word vocabulary list: turn that list into a deck of flashcards!",,,medium,academic,gre
sangfroid,calmness or poise in difficult situations,,,https://storage.googleapis.com/word_vocabulary/words/lucid/movie.mov,"The hostage negotiator exhibited a sangfroid that oftentimes was more menacing than the sword at his throat, or the gun at his head.",,,medium,academic,gre
wanton,"without check or limitation; showing no moral restraints to one's anger, desire, or appetites",,,https://storage.googleapis.com/word_vocabulary/words/lucid/movie.mov,"Due to wanton behavior and crude language, the drunk man was thrown out of the bar and asked to never return.",,,medium,academic,gre
acerbic,harsh in tone,,,https://storage.googleapis.com/word_vocabulary/words/lucid/movie.mov,"Most movie critics are acerbic towards summer blockbusters, often referring to them as garbage.",,,medium,academic,gre
behoove,to be one's duty or obligation,,,https://storage.googleapis.com/word_vocabulary/words/lucid/movie.mov,"The teacher looked down at the student and said, ""It would behoove you to be in class on time and complete your homework, so that you don't repeat freshman English for a third straight year.""",,,medium,academic,gre
vacuous,"devoid of intelligence, matter, or significance",,,https://storage.googleapis.com/word_vocabulary/words/lucid/movie.mov,"To the journalist's pointed question, the senator gave a vacuous response, mixing a few of his overall campaign slogans with platitudes and completely avoiding the controversial subject of the question.",,,medium,academic,gre
assuage,make something intense less severe,,,https://storage.googleapis.com/word_vocabulary/words/lucid/movie.mov,Her fear that the new college would be filled with unknown faces was assuaged when she recognized her childhood friend standing in line.,,,medium,academic,gre
excoriate,to criticize very harshly,,,https://storage.googleapis.com/word_vocabulary/words/lucid/movie.mov,"Entrusted with the prototype to his company’s latest smartphone, Larry, during a late night karaoke bout, let the prototype slip into the hands of a rival company—the next day Larry was excoriated, and then fired.",,,medium,academic,gre
invective,abusive or denunciatory language,,,https://storage.googleapis.com/word_vocabulary/words/lucid/movie.mov,The Internet has unleashed the invectives in many of us; many people post stinging criticism on the comments section underneath newspaper articles or YouTube videos.,,,medium,academic,gre
ostracize,exclude from a community or group,,,https://storage.googleapis.com/word_vocabulary/words/lucid/movie.mov,"Later in his life, Leo Tolstoy was ostracized from the Russian Orthodox Church for his writings that contradicted church doctrine.",,,medium,academic,gre
aplomb,great coolness and composure under strain,,,https://storage.googleapis.com/word_vocabulary/words/lucid/movie.mov,Nancy acted with aplomb during dangerous situations--she once calmly climbed up an oak tree to save a cat.,,,medium,academic,gre
obstinate,resistant to guidance or discipline; stubbornly persistent,,,https://storage.googleapis.com/word_vocabulary/words/lucid/movie.mov,"The coach suggested improvements Sarah might make on the balance beam, but she remained obstinate, unwilling to modify any of the habits that made her successful in the past.",,,medium,academic,gre
rankle,gnaw into; make resentful or angry,,,https://storage.googleapis.com/word_vocabulary/words/lucid/movie.mov,"His constant whistling would rankle her, sometimes causing her to leave in a huff.",,,medium,academic,gre
vicissitude,"change in one’s circumstances, usually for the worse",,,https://storage.googleapis.com/word_vocabulary/words/lucid/movie.mov,"Even great rulers have their vicissitudes—massive kingdoms have diminished overnight, and once beloved kings have faced the scorn of angry masses.",,,medium,academic,gre
analogous,similar in some respects but otherwise different,,,https://storage.googleapis.com/word_vocabulary/words/lucid/movie.mov,"In many ways, the Internet's transformative effect on society has been analogous to that of the printing press.",,,medium,academic,gre
immutable,not able to be changed,,,https://storage.googleapis.com/word_vocabulary/words/lucid/movie.mov,"Taxes are one of the immutable laws of the land, so there is no use arguing about paying them.",,,medium,academic,gre
tenacious,stubbornly unyielding,,,https://storage.googleapis.com/word_vocabulary/words/lucid/movie.mov,Even the most tenacious advocates for gun ownership must admit some of the dangers that firearms present.,,,medium,academic,gre
impertinent,being disrespectful; improperly forward or bold,,,https://storage.googleapis.com/word_vocabulary/words/lucid/movie.mov,"Dexter, distraught over losing his pet dachshund, Madeline, found the police officer’s questions impertinent—after all, he thought, did she have to pry into such details as to what Madeline’s favorite snack was?",,,medium,academic,gre
equivocal,confusing or ambiguous,,,https://storage.googleapis.com/word_vocabulary/words/lucid/movie.mov,The findings of the study were equivocal—the two researchers had different opinions on what the results signified.,,,medium,academic,gre
iconoclastic,defying tradition or convention,,,https://storage.googleapis.com/word_vocabulary/words/lucid/movie.mov,"Jackson Pollack was an iconoclastic artist, totally breaking with tradition by splashing paint on a blank canvas.",,,medium,academic,gre
superfluous,serving no useful purpose,,,https://storage.googleapis.com/word_vocabulary/words/lucid/movie.mov,"How can we hope to stay open if we don't eliminate all superfluous spending, like catered meetings and free acupuncture Tuesday?",,,medium,academic,gre
facetious,cleverly amusing in tone,,,https://storage.googleapis.com/word_vocabulary/words/lucid/movie.mov,Facetious behavior will not be tolerated during sex education class; it's time for all of you to treat these matters like mature adults.,,,medium,academic,gre
amorphous,shapeless,,,https://storage.googleapis.com/word_vocabulary/words/lucid/movie.mov,His study plan for the GRE was at best amorphous; he would do questions from random pages in any one of seven test prep books.,,,medium,academic,gre
economical,"avoiding waste, efficient",,,https://storage.googleapis.com/word_vocabulary/words/lucid/movie.mov,"Journalists favor an economical style of writing, in which no unnecessary words are used and every sentence is as short as possible.",,,medium,academic,gre
crestfallen,brought low in spirit,,,https://storage.googleapis.com/word_vocabulary/words/lucid/movie.mov,I asked Maria on a date and she refused without a moment's thought; I was crestfallen.,,,medium,academic,gre
corollary,a practical consequence that follows naturally,,,https://storage.googleapis.com/word_vocabulary/words/lucid/movie.mov,"A corollary of Hurricane Sandy, which ravaged the east coast of the U.S., is a push to build higher sea walls to protect against future hurricanes.",,,medium,academic,gre
candid,a straightforward and honest look at something,,,https://storage.googleapis.com/word_vocabulary/words/lucid/movie.mov,"Even with a perfect stranger, Charles was always candid and would rarely hold anything back.",,,medium,academic,gre
prognostication,a statement made about the future,,,https://storage.googleapis.com/word_vocabulary/words/lucid/movie.mov,"When the Senator was asked about where the negotiations would lead, he said that any guess he could make would be an unreliable prognostication.",,,medium,academic,gre
underscore,give extra weight to (a communication),,,https://storage.googleapis.com/word_vocabulary/words/lucid/movie.mov,"While the hiking instructor agreed that carrying a first aid kit could be a good idea under certain circumstances, he underscored the importance of carrying enough water.",,,medium,academic,gre
begrudge,to envy someone for possessing or enjoying something,,,https://storage.googleapis.com/word_vocabulary/words/lucid/movie.mov,"Sitting all alone in his room, Harvey begrudged the happiness of the other children playing outside his window.",,,medium,academic,gre
implausible,describing a statement that is not believable,,,https://storage.googleapis.com/word_vocabulary/words/lucid/movie.mov,The teacher found it implausible that the student was late to school because he had been kidnapped by outlaws on horseback.,,,medium,academic,gre
gainsay,deny or contradict; speak against or oppose,,,https://storage.googleapis.com/word_vocabulary/words/lucid/movie.mov,"I can't gainsay a single piece of evidence James has presented, but I still don't trust his conclusion.",,,medium,academic,gre
snide,expressive of contempt; derogatory or mocking in an indirect way,,,https://storage.googleapis.com/word_vocabulary/words/lucid/movie.mov,"The chairman interpreted Taylor's question about promotions as a snide remark, but in all innocence Taylor was trying to figure out the company's process.",,,medium,academic,gre
protean,readily taking on different roles; versatile,,,https://storage.googleapis.com/word_vocabulary/words/lucid/movie.mov,"Peter Sellers was truly a protean actor—in Doctor Strangelove he played three very different roles: a jingoist general, a sedate President and a deranged scientist.",,,medium,academic,gre
sentimental,"effusively or insincerely emotional, especially in art, music, and literature",,,https://storage.googleapis.com/word_vocabulary/words/lucid/movie.mov,I don't like romanticism for the same reason I don't like melodramatic acting and soap operas—overly sentimental.,,,medium,academic,gre
augment,enlarge or increase; improve,,,https://storage.googleapis.com/word_vocabulary/words/lucid/movie.mov,"Ideally, the restaurant's augmented menu will expand its clientele and increase its profits.",,,medium,academic,gre
fawn,try to gain favor by extreme flattery,,,https://storage.googleapis.com/word_vocabulary/words/lucid/movie.mov,"The media fawned over the handsome new CEO, praising his impeccable sense of style instead of asking more pointed questions.",,,medium,academic,gre
excruciating,extremely painful,,,https://storage.googleapis.com/word_vocabulary/words/lucid/movie.mov,"After the boulder rolled a couple of feet, pinning my friend's arm, he experienced excruciating pain.",,,medium,academic,gre
mercurial,(of a person) prone to unexpected and unpredictable changes in mood,,,https://storage.googleapis.com/word_vocabulary/words/lucid/movie.mov,The fact that Ella’s moods were as mercurial as the weather was problematic for her relationships—it didn’t help that she lived in Chicago.,,,medium,academic,gre
harried,troubled persistently especially with petty annoyances,,,https://storage.googleapis.com/word_vocabulary/words/lucid/movie.mov,"With a team of new hires to train, Martha was constantly harried with little questions and could not focus on her projects.",,,medium,academic,gre
discrete,constituting a separate entity or part,,,https://storage.googleapis.com/word_vocabulary/words/lucid/movie.mov,"What was once known as Czechoslovakia has since split into two discrete, independent nations.",,,medium,academic,gre
invidious,likely to cause resentment,,,https://storage.googleapis.com/word_vocabulary/words/lucid/movie.mov,"At a time when many others in the office were about to be laid off, many considered Cheryl's fine clothes that day an invidious display.",,,medium,academic,gre
delegate,give an assignment to (a person),,,https://storage.googleapis.com/word_vocabulary/words/lucid/movie.mov,"Since the senior manager had to go on many international business trips, she was forced to delegate many of her responsibilities to two lower-level managers.",,,medium,academic,gre
burgeon,grow and flourish,,,https://storage.googleapis.com/word_vocabulary/words/lucid/movie.mov,"China's housing market is burgeoning, but some predict that the growth is merely a bubble and will burst much like the U.S. real estate bubble of 2008.",,,medium,academic,gre
venality,the condition of being susceptible to bribes or corruption,,,https://storage.googleapis.com/word_vocabulary/words/lucid/movie.mov,"Even some of the most sacred sporting events are not immune to venality, as many of the officials have received substantial bribes to make biased calls.",,,medium,academic,gre
vanquish,"come out better in a competition, race, or conflict",,,https://storage.googleapis.com/word_vocabulary/words/lucid/movie.mov,"For years, Argentina would dominate in World Cup qualifying matches, only to be vanquished by one of the European countries during the late stages of the tournament.",,,medium,academic,gre
veritable,"truthfully, without a doubt",,,https://storage.googleapis.com/word_vocabulary/words/lucid/movie.mov,"Frank is a veritable life-saver -- last year, on two different occasions, he revived people using CPR.",,,medium,academic,gre
pragmatic,guided by practical experience and observation rather than theory,,,https://storage.googleapis.com/word_vocabulary/words/lucid/movie.mov,"Rather than make a philosophical appeal to the Congressmen, the Speaker decided to take a far more pragmatic approach, making small side-deals that would add votes to his bill.",,,medium,academic,gre
colossal,so great in size or force or extent as to elicit awe,,,https://storage.googleapis.com/word_vocabulary/words/lucid/movie.mov,"Few appreciate the colossal scale of the sun: if hollow, it could contain a million Earths.",,,medium,academic,gre
enjoin,give instructions to or direct somebody to do something with authority,,,https://storage.googleapis.com/word_vocabulary/words/lucid/movie.mov,The government agency enjoined the chemical company to clean up the hazardous dump it had created over the years.,,,medium,academic,gre
ravenous,extremely hungry; devouring or craving food in great quantities,,,https://storage.googleapis.com/word_vocabulary/words/lucid/movie.mov,"John didn't eat much at all during the week he had the flu, so now that he is regaining his health, it's not surprising that he has a ravenous appetite.",,,medium,academic,gre
affable,likeable; easy to talk to,,,https://storage.googleapis.com/word_vocabulary/words/lucid/movie.mov,"For all his surface affability, Marco was remarkably glum when he wasn’t around other people.",,,medium,academic,gre
hubris,overbearing pride or presumption,,,https://storage.googleapis.com/word_vocabulary/words/lucid/movie.mov,"Bill Clinton was criticized for his hubris, since he believed he could get away with anything once in the White House.",,,medium,academic,gre
destitute,poor enough to need help from others,,,https://storage.googleapis.com/word_vocabulary/words/lucid/movie.mov,"Jean Valjean, is at first destitute, but through the grace of a priest, he makes something of his life.",,,medium,academic,gre
hamper,prevent the progress or free movement of,,,https://storage.googleapis.com/word_vocabulary/words/lucid/movie.mov,"As the rain water began to collect in pools on the highway, it began to hamper the flow of traffic.",,,medium,academic,gre
ersatz,not real or genuine; phony,,,https://storage.googleapis.com/word_vocabulary/words/lucid/movie.mov,"The car dealer's ersatz laughter was immediately followed by a price quote, one that Shelley found highly inflated.",,,medium,academic,gre
reconcile,make (one thing) compatible with (another),,,https://storage.googleapis.com/word_vocabulary/words/lucid/movie.mov,Peggy was unable to reconcile her kind friend Jane with the cruel and merciless character Jane played on television.,,,medium,academic,gre
pittance,a small amount (of money),,,https://storage.googleapis.com/word_vocabulary/words/lucid/movie.mov,Vinny’s uncle beamed smugly about how he’d offered his nephew fifty dollars for his Harvard tuition; even twice the amount would have been a mere pittance.,,,medium,academic,gre
entrenched,fixed firmly or securely,,,https://storage.googleapis.com/word_vocabulary/words/lucid/movie.mov,"By the time we reach 60-years old, most of our habits are so entrenched that it is difficult for us to change.",,,medium,academic,gre
opaque,not clearly understood or expressed,,,https://storage.googleapis.com/word_vocabulary/words/lucid/movie.mov,"The meaning of the professor's new research was opaque to most people, so no one asked any questions.",,,medium,academic,gre
ribald,humorously vulgar,,,https://storage.googleapis.com/word_vocabulary/words/lucid/movie.mov,"The speaker was famous for his ribald humor, but the high school principal asked him to keep the talk G-rated when he spoke to the student body.",,,medium,academic,gre
intimate,to suggest something subtly,,,https://storage.googleapis.com/word_vocabulary/words/lucid/movie.mov,"At first Manfred’s teachers intimated to his parents that he was not suited to skip a grade; when his parents protested, teachers explicitly told them that, notwithstanding the boy’s precocity, he was simply too immature to jump to the 6th grade.",,,medium,academic,gre
jocular,characterized by jokes and good humor,,,https://storage.googleapis.com/word_vocabulary/words/lucid/movie.mov,"My uncle was always in a jocular mood at family gatherings, messing up people's hair and telling knock-knock jokes to anyone who would listen.",,,medium,academic,gre
exacerbate,make worse,,,https://storage.googleapis.com/word_vocabulary/words/lucid/movie.mov,"Her sleeplessness exacerbated her cold--when she woke up the next day, her sinuses were completely blocked.",,,medium,academic,gre
decry,express strong disapproval of,,,https://storage.googleapis.com/word_vocabulary/words/lucid/movie.mov,"The entire audience erupted in shouts and curses, decrying the penalty card issued by the referee.",,,medium,academic,gre
irrevocable,incapable of being retracted or revoked,,,https://storage.googleapis.com/word_vocabulary/words/lucid/movie.mov,"Once you enter your plea to the court, it is irrevocable so think carefully about what you will say.",,,medium,academic,gre
