word,meaning,mnemonic,image,video,example,synonyms,antonyms,difficulty,category,setIds
disheartened,made less hopeful or enthusiastic,,,https://storage.googleapis.com/word_vocabulary/words/lucid/movie.mov,"After the visiting team scored nine times, the home team's fans were disheartened, some leaving the game early.",,,medium,academic,gre
antithetical,sharply contrasted in character or purpose,,,https://storage.googleapis.com/word_vocabulary/words/lucid/movie.mov,"His deep emotional involvement with these ideas is, in fact, antithetical to the disattachment Buddhism preaches.",,,medium,academic,gre
provincial,characteristic of a limited perspective; not fashionable or sophisticated,,,https://storage.googleapis.com/word_vocabulary/words/lucid/movie.mov,"Maggie's enthusiasm about her high school teams seemed provincial to her college classmates, all of whom were following a nationally ranked college team.",,,medium,academic,gre
moribund,being on the point of death; declining rapidly losing all momentum in progress,,,https://storage.googleapis.com/word_vocabulary/words/lucid/movie.mov,"Whether you like it or not, jazz as a genre is moribund at best, possibly already dead.",,,medium,academic,gre
stymie,hinder or prevent the progress or accomplishment of,,,https://storage.googleapis.com/word_vocabulary/words/lucid/movie.mov,The engineers found their plans stymied at every turn and were ultimately able to make almost no progress on the project.,,,medium,academic,gre
acrimony,bitterness and ill will,,,https://storage.googleapis.com/word_vocabulary/words/lucid/movie.mov,The acrimony between the president and vice-president sent a clear signal to voters: the health of the current administration was imperiled.,,,medium,academic,gre
copious,in abundant supply,,,https://storage.googleapis.com/word_vocabulary/words/lucid/movie.mov,"In midsummer, there are copious popsicle stands at the beach; in the winter, there are none.",,,medium,academic,gre
pine,to yearn for,,,https://storage.googleapis.com/word_vocabulary/words/lucid/movie.mov,"Standing forlornly by the window, she pined for her lost love.",,,medium,academic,gre
patronize,treat condescendingly,,,https://storage.googleapis.com/word_vocabulary/words/lucid/movie.mov,"She says she genuinely wanted to help me, but instead she patronized me, constantly pointing out how I was inferior to her.",,,medium,academic,gre
redoubtable,inspiring fear or awe,,,https://storage.googleapis.com/word_vocabulary/words/lucid/movie.mov,"On television basketball players don't look that tall, but when you stand in front of a seven-foot tall NBA player, he is truly redoubtable.",,,medium,academic,gre
fete,to celebrate a person,,,https://storage.googleapis.com/word_vocabulary/words/lucid/movie.mov,"After World War II, war heroes were feted at first but quickly forgotten.",,,medium,academic,gre
cardinal,of primary importance; fundamental,,,https://storage.googleapis.com/word_vocabulary/words/lucid/movie.mov,Most cultures consider gambling a cardinal sin and thus have outlawed its practice.,,,medium,academic,gre
vociferous,conspicuously and offensively loud; given to vehement outcry,,,https://storage.googleapis.com/word_vocabulary/words/lucid/movie.mov,"In giving Marcia a particular vociferous response, Paul caused people at every other table in the restaurant to turn around and look at them angrily.",,,medium,academic,gre
lionize,assign great social importance to,,,https://storage.googleapis.com/word_vocabulary/words/lucid/movie.mov,"Students in the U.S. learn to lionize Jefferson, Franklin, and Washington because they are the founding fathers of the nation.",,,medium,academic,gre
resignation,the acceptance of something unpleasant that can't be avoided,,,https://storage.googleapis.com/word_vocabulary/words/lucid/movie.mov,"Since Jack could not think of a convincing reason why he had to miss the seminar, he attended it with a sense of resignation.",,,medium,academic,gre
irascible,quickly aroused to anger,,,https://storage.googleapis.com/word_vocabulary/words/lucid/movie.mov,"If Arthur's dog is not fed adequately, he becomes highly irascible, even growling at his own shadow.",,,medium,academic,gre
construe,interpreted in a particular way,,,https://storage.googleapis.com/word_vocabulary/words/lucid/movie.mov,The author's inability to take a side on the issue was construed by both his opponents and supporters as a sign of weakness.,,,medium,academic,gre
exemplify,be characteristic of,,,https://storage.googleapis.com/word_vocabulary/words/lucid/movie.mov,"Lincoln exemplified the best of not only America, but also the potential greatness that exists within each person.",,,medium,academic,gre
subsume,contain or include,,,https://storage.googleapis.com/word_vocabulary/words/lucid/movie.mov,"The rogue wave quickly subsumed the pier and boardwalk, destroying everything in its path.",,,medium,academic,gre
impartial,free from undue bias or preconceived opinions,,,https://storage.googleapis.com/word_vocabulary/words/lucid/movie.mov,The judge was not impartial since he had been bribed by the witness's family.,,,medium,academic,gre
tact,consideration in dealing with others and avoiding giving offense,,,https://storage.googleapis.com/word_vocabulary/words/lucid/movie.mov,"In a tremendous display of tact, Shelly was able to maintain a strong friendship with Marcia, even though Marcia's husband, Frank, confessed to finding Shelley more attractive than Marcia.",,,medium,academic,gre
brazen,unrestrained by convention or propriety,,,https://storage.googleapis.com/word_vocabulary/words/lucid/movie.mov,"Their large ""donations"" to the local police department gave the drug cartel the brazen confidence to do their business out in the open.",,,medium,academic,gre
countermand,a contrary command cancelling or reversing a previous command,,,https://storage.googleapis.com/word_vocabulary/words/lucid/movie.mov,"By the time the colonel countermanded his soldiers not to land in enemy territory, a few helicopters had already touched down amid heavy gunfire.",,,medium,academic,gre
perfidy,an act of deliberate betrayal; a breach of a trust,,,https://storage.googleapis.com/word_vocabulary/words/lucid/movie.mov,"Sure he was the best salesman in the company, but Michael had abused the trust of the firm, sharing product secrets with a competitor, and for such perfidy he was terminated.",,,medium,academic,gre
eschew,avoid and stay away from deliberately; stay clear of,,,https://storage.googleapis.com/word_vocabulary/words/lucid/movie.mov,Politicians are the masters of eschewing morals; academics are the masters of eschewing clarity.,,,medium,academic,gre
impecunious,lacking money; poor,,,https://storage.googleapis.com/word_vocabulary/words/lucid/movie.mov,"In extremely trying times, even the moderately wealthy, after a few turns of ill-fortune, can become impecunious.",,,medium,academic,gre
replete,completely stocked or furnished with something,,,https://storage.googleapis.com/word_vocabulary/words/lucid/movie.mov,"Only weeks after the hurricane made landfall, the local supermarket shelves were replete with goods, so quick was the disaster relief response.",,,medium,academic,gre
ambivalent,mixed or conflicting emotions about something,,,https://storage.googleapis.com/word_vocabulary/words/lucid/movie.mov,"Sam was ambivalent about studying for the exam because doing so ate up a lot of his time, yet he was able to improve his analytical skills.",,,medium,academic,gre
complacent,contented to a fault with oneself or one's actions,,,https://storage.googleapis.com/word_vocabulary/words/lucid/movie.mov,"After the water polo team won their sixth championship, they became complacent and didn't even make it to the playoffs the next year.",,,medium,academic,gre
ambiguous,open to more than one interpretation,,,https://storage.googleapis.com/word_vocabulary/words/lucid/movie.mov,"The coach told his team, “Move towards that side of the field”; because he did not point, his directions were ambiguous, and the team had no idea to which side he was referring.",,,medium,academic,gre
magisterial,offensively self-assured or given to exercising unwarranted power,,,https://storage.googleapis.com/word_vocabulary/words/lucid/movie.mov,"Though she was only a third grade teacher, Ms. Martinet was magisterial in dealing with her class, lording over them like a queen.",,,medium,academic,gre
austere,practicing self-denial,,,https://storage.googleapis.com/word_vocabulary/words/lucid/movie.mov,His lifestyle of revelry and luxurious excess could hardly be called austere.,,,medium,academic,gre
obstreperous,noisily and stubbornly defiant; willfully difficult to control,,,https://storage.googleapis.com/word_vocabulary/words/lucid/movie.mov,"When the teacher asked the obstreperous student simply to bus his tray, the student threw the entire tray on the floor, shouted an epithet, and walked out.",,,medium,academic,gre
facile,arrived at without due care or effort; lacking depth,,,https://storage.googleapis.com/word_vocabulary/words/lucid/movie.mov,"Many news shows provide facile explanations to complex politics, so I prefer to read the in-depth reporting of The New York Times.",,,medium,academic,gre
idiosyncrasy,a behavioral attribute that is distinctive and peculiar to an individual,,,https://storage.googleapis.com/word_vocabulary/words/lucid/movie.mov,"Peggy's numerous idiosyncrasies include wearing mismatched shoes, laughing loudly to herself, and owning a pet aardvark.",,,medium,academic,gre
meticulous,marked by extreme care in treatment of details,,,https://storage.googleapis.com/word_vocabulary/words/lucid/movie.mov,The Japanese noodle maker was meticulous in making his noodles and would never let another person take over the task.,,,medium,academic,gre
arduous,demanding considerable mental effort and skill; testing powers of endurance,,,https://storage.googleapis.com/word_vocabulary/words/lucid/movie.mov,"In order to deal with the arduous cross-country journey, truck drivers often survive on a string of caffeinated drinks, staying awake for up to 30 hours at a time.",,,medium,academic,gre
ferret,to search for something persistently,,,https://storage.googleapis.com/word_vocabulary/words/lucid/movie.mov,"Ever the resourceful lexicographer, Fenton was able to ferret out the word origin of highly obscure words.",,,medium,academic,gre
artful,exhibiting artistic skill,,,https://storage.googleapis.com/word_vocabulary/words/lucid/movie.mov,Picasso is generally considered the most artful member of the Cubist movement.,,,medium,academic,gre
tendentious,likely to lean towards a controversial view,,,https://storage.googleapis.com/word_vocabulary/words/lucid/movie.mov,"Because political mudslinging has become a staple of the 24-hour media cycle, most of us, despite protestations to the contrary, are tendentious on many of today’s pressing issues.",,,medium,academic,gre
sententious,"to be moralizing, usually in a pompous sense",,,https://storage.googleapis.com/word_vocabulary/words/lucid/movie.mov,"The old man, casting his nose up in the air at the group of adolescents, intoned sententiously, “Youth is wasted on the young.”",,,medium,academic,gre
maintain,to assert,,,https://storage.googleapis.com/word_vocabulary/words/lucid/movie.mov,The scientist maintained that the extinction of dinosaurs was most likely brought about by a drastic change in climate.,,,medium,academic,gre
negligible,so small as to be meaningless; insignificant,,,https://storage.googleapis.com/word_vocabulary/words/lucid/movie.mov,"The GRE tests cumulative knowledge, so if you cram the night before it is, at best, likely to only have a negligible impact on your score.",,,medium,academic,gre
curmudgeon,"a grouchy, surly person",,,https://storage.googleapis.com/word_vocabulary/words/lucid/movie.mov,"Since Uncle Mike was the family curmudgeon, each Thanksgiving he was plied with copious amounts of wine, in the hope that he would become less grouchy.",,,medium,academic,gre
remonstrate,to make objections while pleading,,,https://storage.googleapis.com/word_vocabulary/words/lucid/movie.mov,"The mothers of the kidnapped victims remonstrated to the rogue government to release their children, claiming that the detention violated human rights.",,,medium,academic,gre
innocuous,harmless and doesn’t produce any ill effects,,,https://storage.googleapis.com/word_vocabulary/words/lucid/movie.mov,"Everyone found Nancy’s banter innocuous—except for Mike, who felt like she was intentionally picking on him.",,,medium,academic,gre
recrimination,mutual accusations,,,https://storage.googleapis.com/word_vocabulary/words/lucid/movie.mov,"The two brothers sat and cried, pointing fingers and making elaborate recriminations of the other's guilt",,,medium,academic,gre
infelicitous,inappropriate,,,https://storage.googleapis.com/word_vocabulary/words/lucid/movie.mov,"During the executive meeting, the marketing director continued to make infelicitous comments about the CEO's gambling habit.",,,medium,academic,gre
gumption,resourcefulness and determination,,,https://storage.googleapis.com/word_vocabulary/words/lucid/movie.mov,"Wallace Stegner lamented the lack of gumption in the U.S. during the sixties, claiming that no young person knew the value of work.",,,medium,academic,gre
oblique,not straightforward; indirect,,,https://storage.googleapis.com/word_vocabulary/words/lucid/movie.mov,"Herbert never explicitly revealed anything negative about Tom's past, but at times he would obliquely suggest that Tom was not as innocent as he seemed.",,,medium,academic,gre
quandary,state of uncertainty or perplexity especially as requiring a choice between equally unfavorable options,,,https://storage.googleapis.com/word_vocabulary/words/lucid/movie.mov,"Steve certainly is in a quandary: if he doesn't call Elaine, she will blame him for everything, but if he does call her, the evidence of where he currently is could cost him his job.",,,medium,academic,gre
sedulous,done diligently and carefully,,,https://storage.googleapis.com/word_vocabulary/words/lucid/movie.mov,"An avid numismatist, Harold sedulously amassed a collection of coins from over 100 countries—an endeavor that took over fifteen years, and to five continents.",,,medium,academic,gre
goad,urge on with unpleasant comments,,,https://storage.googleapis.com/word_vocabulary/words/lucid/movie.mov,"Doug did not want to enter the race, but Jim, through a steady stream of taunts, goaded him into signing up for it.",,,medium,academic,gre
telling,significant and revealing of another factor,,,https://storage.googleapis.com/word_vocabulary/words/lucid/movie.mov,Her unbecoming dress was very telling when it came to her sense of fashion.,,,medium,academic,gre
preempt,take the place of or have precedence over,,,https://storage.googleapis.com/word_vocabulary/words/lucid/movie.mov,A governmental warning about an imminent terrorist attack would preempt ordinary network programming on television.,,,medium,academic,gre
genteel,marked by refinement in taste and manners,,,https://storage.googleapis.com/word_vocabulary/words/lucid/movie.mov,A live string quartet would provide a more genteel air to the wedding than would a folk singer.,,,medium,academic,gre
besiege,"harass, as with questions or requests; cause to feel distressed or worried",,,https://storage.googleapis.com/word_vocabulary/words/lucid/movie.mov,"After discovering a priceless artifact in her backyard, Jane was besieged by phone calls, emails, and reporters all trying to buy, hold or see the rare piece of history.",,,medium,academic,gre
abstruse,difficult to understand; incomprehensible,,,https://storage.googleapis.com/word_vocabulary/words/lucid/movie.mov,Physics textbooks can seem so abstruse to the uninitiated that readers feel as though they are looking at hieroglyphics.,,,medium,academic,gre
staunch,firm and dependable especially in loyalty,,,https://storage.googleapis.com/word_vocabulary/words/lucid/movie.mov,"No longer a staunch supporter of the movement, Todd now will openly question whether its goals are worthwhile.",,,medium,academic,gre
vilify,spread negative information about,,,https://storage.googleapis.com/word_vocabulary/words/lucid/movie.mov,"Todd was noble after the divorce, choosing to say only complimentary things about Barbara, but Barbara did not hesitate to vilify Todd.",,,medium,academic,gre
prevaricate,to speak in an evasive way,,,https://storage.googleapis.com/word_vocabulary/words/lucid/movie.mov,"The cynic quipped, “There is not much variance in politicians; they all seem to prevaricate”.",,,medium,academic,gre
irresolute,uncertain how to act or proceed,,,https://storage.googleapis.com/word_vocabulary/words/lucid/movie.mov,"He stood irresolute at the split in the trail, not sure which route would lead back to the camp.",,,medium,academic,gre
badger,to pester,,,https://storage.googleapis.com/word_vocabulary/words/lucid/movie.mov,"Badgered by his parents to find a job, the 30-year-old loafer instead joined a gang of itinerant musicians.",,,medium,academic,gre
subversive,in opposition to an establish system or institution.,,,https://storage.googleapis.com/word_vocabulary/words/lucid/movie.mov,"The ruling political party has begun a campaign to shut down subversive websites that it deems as a threat to ""national safety.""",,,medium,academic,gre
avid,marked by active interest and enthusiasm,,,https://storage.googleapis.com/word_vocabulary/words/lucid/movie.mov,"Martin is an avid birdwatcher, often taking long hikes into remote mountains to see some rare eagle.",,,medium,academic,gre
derive,"come from; be connected by a relationship of blood, for example",,,https://storage.googleapis.com/word_vocabulary/words/lucid/movie.mov,"Many words in the English language are derived from Latin, including the word ""derive.""",,,medium,academic,gre
haughty,having or showing arrogant superiority to and disdain of those one views as unworthy,,,https://storage.googleapis.com/word_vocabulary/words/lucid/movie.mov,The haughty manager didn't believe that any of his subordinates could ever have an insight as brilliant as his own.,,,medium,academic,gre
apothegm,"a short, pithy instructive saying",,,https://storage.googleapis.com/word_vocabulary/words/lucid/movie.mov,"Winston Churchill is famous for many apothegms, but this might be his most famous: ""It has been said that democracy is the worst form of government except all the others that have been tried.""",,,medium,academic,gre
apex,the highest point,,,https://storage.googleapis.com/word_vocabulary/words/lucid/movie.mov,The Ivy League is considered the apex of the secondary education system.,,,medium,academic,gre
decorum,propriety in manners and conduct,,,https://storage.googleapis.com/word_vocabulary/words/lucid/movie.mov,"""You will obey the rules of decorum for this courtroom or spend the night in a jail cell,"" said the judge to the prosecutor.",,,medium,academic,gre
perturb,disturb in mind or cause to be worried or alarmed,,,https://storage.googleapis.com/word_vocabulary/words/lucid/movie.mov,"Now that Henry is recovering from a major illnesses, he no longer lets the little trivialities, such as late mail, perturb him.",,,medium,academic,gre
brook,put up with something or somebody unpleasant,,,https://storage.googleapis.com/word_vocabulary/words/lucid/movie.mov,"While she was at the chalkboard, the teacher did not brook any form of talking--even a tiny peep resulted in afternoon detention.",,,medium,academic,gre
haphazard,marked by great carelessness; dependent upon or characterized by chance,,,https://storage.googleapis.com/word_vocabulary/words/lucid/movie.mov,"Many golf courses are designed with great care, but the greens on the county golf course seem entirely haphazard.",,,medium,academic,gre
besotted,strongly affectionate towards,,,https://storage.googleapis.com/word_vocabulary/words/lucid/movie.mov,"Even though her father did not approve, Juliet became besotted with the young Romeo.",,,medium,academic,gre
anemic,lacking energy and vigor,,,https://storage.googleapis.com/word_vocabulary/words/lucid/movie.mov,"After three straight shows, the lead actress gave an anemic performance the fourth night, barely speaking loudly enough for those in the back rows to hear.",,,medium,academic,gre
sinecure,an office that involves minimal duties,,,https://storage.googleapis.com/word_vocabulary/words/lucid/movie.mov,"The position of Research Director is a sinecure: the job entails almost no responsibilities, nor does the person in that position have to answer to anyone.",,,medium,academic,gre
blatant,without any attempt at concealment; completely obvious,,,https://storage.googleapis.com/word_vocabulary/words/lucid/movie.mov,Allen was often punished in school for blatantly disrespecting teachers.,,,medium,academic,gre
pollyannaish,extremely optimistic,,,https://storage.googleapis.com/word_vocabulary/words/lucid/movie.mov,"Even in the midst of a lousy sales quarter, Debbie remained Pollyannaish, never losing her shrill voice and wide smile, even when prospective customers hung up on her.",,,medium,academic,gre
antipathy,an intense feeling of dislike or aversion,,,https://storage.googleapis.com/word_vocabulary/words/lucid/movie.mov,"Maria had an antipathy for tour groups, often bolting to the other side of the museum as soon as she saw a chaperone leading a group of wide-eyed tourists.",,,medium,academic,gre
derivative,"not original but drawing strongly on something already in existence, especially in reference to a creative product (e.g. music, writing, poetry etc.).",,,https://storage.googleapis.com/word_vocabulary/words/lucid/movie.mov,"Because the movies were utterly derivative of other popular movies, they did well at the box office.",,,medium,academic,gre
derelict,(of a person) not doing one's duties,,,https://storage.googleapis.com/word_vocabulary/words/lucid/movie.mov,The teacher was derelict in her duties because she hadn't graded a single student paper in three weeks.,,,medium,academic,gre
bereft,unhappy in love; suffering from unrequited love,,,https://storage.googleapis.com/word_vocabulary/words/lucid/movie.mov,"After 64 years of marriage, William was bereft after the death of his wife.",,,medium,academic,gre
apogee,the highest point,,,https://storage.googleapis.com/word_vocabulary/words/lucid/movie.mov,"The apogee of the Viennese style of music, Mozart’s music continues to mesmerize audiences well into the 21st century.",,,medium,academic,gre
bumbling,"lacking physical movement skills, especially with the hands",,,https://storage.googleapis.com/word_vocabulary/words/lucid/movie.mov,"Within a week of starting, the bumbling new waiter was unceremoniously fired.",,,medium,academic,gre
petulant,easily irritated or annoyed,,,https://storage.googleapis.com/word_vocabulary/words/lucid/movie.mov,"When Ed first met Ruth, he didn't realize she was so petulant, but now that they are three months into their relationship, Ed feels a day doesn't go by in which she isn't whining about some minor issue.",,,medium,academic,gre
impervious,not admitting of passage or capable of being affected,,,https://storage.googleapis.com/word_vocabulary/words/lucid/movie.mov,I am not impervious to your insults; they cause me great pain.,,,medium,academic,gre
disparate,two things are fundamentally different,,,https://storage.googleapis.com/word_vocabulary/words/lucid/movie.mov,"With the advent of machines capable of looking inside the brain, fields as disparate as religion and biology have been brought together by scientists trying to understand what happens in the brain when people have a religious experience.",,,medium,academic,gre
trenchant,"characterized by or full of force and vigor; having keenness and forcefulness and penetration in thought, expression, or intellect",,,https://storage.googleapis.com/word_vocabulary/words/lucid/movie.mov,"Jill presented a rather superficial treatment of sales in Asia, but her trenchant analysis of sales in Europe inspired a number of insights into how to proceed in that market.",,,medium,academic,gre
amenable,easily persuaded,,,https://storage.googleapis.com/word_vocabulary/words/lucid/movie.mov,"Even though she did not like the outdoors, Shirley was generally amenable and so her brother was able to persuade her to go camping.",,,medium,academic,gre
denigrate,charge falsely or with malicious intent; attack the good name and reputation of someone,,,https://storage.googleapis.com/word_vocabulary/words/lucid/movie.mov,"Count Rumford denigrated the new theory of heat, demonstrating that it was wholly inadequate to explain the observations.",,,medium,academic,gre
indigenous,originating in a certain area,,,https://storage.googleapis.com/word_vocabulary/words/lucid/movie.mov,The plants and animals indigenous to Australia are notably different from those indigenous to the U.S—one look at a duckbill platypus and you know you’re not dealing with an opossum.,,,medium,academic,gre
banality,a trite or obvious remark,,,https://storage.googleapis.com/word_vocabulary/words/lucid/movie.mov,Herbert regarded the minister's remark as a mere banality until Sharon pointed out profound implications to the seemingly obvious words.,,,medium,academic,gre
thwart,"hinder or prevent (the efforts, plans, or desires) of",,,https://storage.googleapis.com/word_vocabulary/words/lucid/movie.mov,"I wanted to spend a week in New York this autumn, but the high costs of travel and lodging thwarted my plans.",,,medium,academic,gre
placid,not easily irritated,,,https://storage.googleapis.com/word_vocabulary/words/lucid/movie.mov,"Doug is normally placid, so we were all shocked to see him yelling at the television when the Mets lost the game.",,,medium,academic,gre
